{
  "audio": {
    "trilha_sonora": "trilha instrumental discreta, volume baixo"
  },
  "cenas": [
    {
      "id": "c-001",
      "nos": [
        "n-001"
      ]
    },
    {
      "id": "c-002",
      "nos": [
        "n-002",
        "n-003"
      ]
    },
    {
      "id": "c-003",
      "nos": [
        "n-005",
        "n-008",
        "n-004"
      ]
    },
    {
      "audio_cena": {
        "texto_locucao": "Nesta seção, apresentamos os dados de desempenho do pipeline. Cada tipo de nó tem características de renderização distintas."
      },
      "id": "c-004",
      "nos": [
        "n-009",
        "n-010",
        "n-011",
        "n-012",
        "n-013"
      ]
    },
    {
      "audio_cena": {
        "texto_locucao": "Concluindo, o manifesto é a peça central do pipeline. Obrigado por assistir."
      },
      "id": "c-005",
      "nos": [
        "n-014",
        "n-006",
        "n-007",
        "n-015"
      ]
    }
  ],
  "nos": [
    {
      "id": "n-001",
      "schema": "Cabecalho.1",
      "subtitulo": "Da ideia ao frame final, sem edição manual",
      "texto": "Editor de Vídeo IA — Pipeline Declarativo",
      "type": "cabecalho"
    },
    {
      "destaque": true,
      "id": "n-002",
      "schema": "Texto.1",
      "texto": "O pipeline converte um manifesto JSON em vídeo renderizado. Cada nó visual é uma unidade atômica com tipo, duração e animação independentes.",
      "type": "texto"
    },
    {
      "id": "n-003",
      "itens": [
        "Cabeçalho: título e subtítulo com alinhamento configurável",
        "Texto: corpo com destaque opcional e animação de entrada",
        "Lista: itens ordenados ou não, com bullets automáticos"
      ],
      "ordenada": false,
      "schema": "Lista.1",
      "type": "lista"
    },
    {
      "id": "n-004",
      "itens": [
        "Primeiro passo: definir o manifesto",
        "Segundo passo: validar contra o schema",
        "Terceiro passo: resolver timeline",
        "Quarto passo: renderizar com Remotion"
      ],
      "ordenada": true,
      "schema": "Lista.1",
      "type": "lista"
    },
    {
      "id": "n-005",
      "schema": "Midia.1",
      "texto_alternativo": "Diagrama do pipeline de renderização mostrando as etapas: manifesto → validação → timeline → Remotion → vídeo",
      "tipo_midia": "imagem",
      "type": "midia"
    },
    {
      "id": "n-006",
      "schema": "Midia.1",
      "texto_alternativo": "Demonstração curta do editor em ação: uma cena com transição slide entre dois nós de texto",
      "tipo_midia": "video",
      "type": "midia"
    },
    {
      "id": "n-007",
      "schema": "Midia.1",
      "texto_alternativo": "Animação mostrando a interface do editor montando uma cena a partir de nós de texto",
      "tipo_midia": "gif",
      "type": "midia"
    },
    {
      "codigo": "export const VideoEditor: React.FC<{ manifesto: Manifesto }> = ({ manifesto }) => {\n  return manifesto.cenas.map((cena) => (\n    <Sequence key={cena.id}>\n      {cena.nos.map((nodeId) => renderNode(nodeId))}\n    </Sequence>\n  ));\n};",
      "id": "n-008",
      "linguagem": "typescript",
      "linhas_destaque": [
        1,
        3,
        5
      ],
      "schema": "Codigo.1",
      "type": "codigo"
    },
    {
      "dados": [
        {
          "rotulo": "Cabeçalho",
          "valor": 45
        },
        {
          "rotulo": "Texto",
          "valor": 32
        },
        {
          "rotulo": "Lista",
          "valor": 78
        },
        {
          "rotulo": "Mídia",
          "valor": 210
        },
        {
          "rotulo": "Código",
          "valor": 156
        },
        {
          "rotulo": "Gráfico",
          "valor": 95
        }
      ],
      "id": "n-009",
      "schema": "Grafico.1",
      "tipo_grafico": "barras",
      "titulo": "Tempo de Render por Tipo de Nó (ms)",
      "type": "grafico"
    },
    {
      "dados": [
        {
          "rotulo": "Dia 1",
          "valor": 1200
        },
        {
          "rotulo": "Dia 2",
          "valor": 980
        },
        {
          "rotulo": "Dia 3",
          "valor": 750
        },
        {
          "rotulo": "Dia 4",
          "valor": 620
        },
        {
          "rotulo": "Dia 5",
          "valor": 510
        }
      ],
      "id": "n-010",
      "schema": "Grafico.1",
      "tipo_grafico": "linha",
      "titulo": "Evolução do Tempo Total de Render",
      "type": "grafico"
    },
    {
      "dados": [
        {
          "rotulo": "Texto",
          "valor": 35
        },
        {
          "rotulo": "Cabeçalho",
          "valor": 20
        },
        {
          "rotulo": "Mídia",
          "valor": 15
        },
        {
          "rotulo": "Código",
          "valor": 15
        },
        {
          "rotulo": "Gráfico",
          "valor": 10
        },
        {
          "rotulo": "Lista",
          "valor": 5
        }
      ],
      "id": "n-011",
      "schema": "Grafico.1",
      "tipo_grafico": "pizza",
      "titulo": "Distribuição de Tipos de Nó",
      "type": "grafico"
    },
    {
      "dados": [
        {
          "rotulo": "Jan",
          "valor": 100
        },
        {
          "rotulo": "Fev",
          "valor": 200
        },
        {
          "rotulo": "Mar",
          "valor": 150
        }
      ],
      "id": "n-012",
      "schema": "Grafico.1",
      "tipo_grafico": "area",
      "type": "grafico"
    },
    {
      "dados": [
        {
          "rotulo": "A",
          "valor": 1.5
        },
        {
          "rotulo": "B",
          "valor": 3.2
        },
        {
          "rotulo": "C",
          "valor": 2.8
        }
      ],
      "id": "n-013",
      "schema": "Grafico.1",
      "tipo_grafico": "dispersao",
      "type": "grafico"
    },
    {
      "destaque": false,
      "id": "n-014",
      "schema": "Texto.1",
      "texto": "O manifesto é a fonte única de verdade. Um arquivo JSON versionado por objeto, validado contra JSON Schema 2020-12, com subset para LLM. A timeline resolvida é gerada deterministicamente a partir das âncoras absolutas — nunca somando durações.",
      "type": "texto"
    },
    {
      "id": "n-015",
      "schema": "Cabecalho.1",
      "texto": "Fim",
      "type": "cabecalho"
    }
  ],
  "schema_version": "Autoria.1"
}
