{
  "schema_version": "Autoria.1",
  "nos": [
    {
      "id": "n-001",
      "schema": "Cabecalho.1",
      "type": "cabecalho",
      "texto": "Orquestrador de containers",
      "subtitulo": "Muitos servicos, uma unica equipe de operacao"
    },
    {
      "id": "n-002",
      "schema": "Texto.1",
      "type": "texto",
      "texto": "Um orquestrador sobe, escala e conserta containers por voce.",
      "destaque": true
    },
    {
      "id": "n-003",
      "schema": "Lista.1",
      "type": "lista",
      "itens": [
        "Sobe containers em maquinas saudaveis",
        "Reinicia o que parou",
        "Escala replicas quando o trafego cresce"
      ]
    },
    {
      "id": "n-004",
      "schema": "Codigo.1",
      "type": "codigo",
      "codigo": "replicas: 3\nimage: api:v2",
      "linguagem": "yaml"
    },
    {
      "id": "n-005",
      "schema": "Midia.1",
      "type": "midia",
      "tipo_midia": "imagem",
      "texto_alternativo": "Diagrama com tres replicas conectadas a um balanceador de carga"
    },
    {
      "id": "n-006",
      "schema": "Grafico.1",
      "type": "grafico",
      "tipo_grafico": "linha",
      "titulo": "Replicas sob trafego",
      "dados": [
        {
          "rotulo": "09h",
          "valor": 2
        },
        {
          "rotulo": "12h",
          "valor": 6
        }
      ]
    }
  ],
  "cenas": [
    {
      "id": "c-001",
      "nos": [
        "n-001",
        "n-002"
      ],
      "transicao_entrada": {
        "tipo": "fade"
      },
      "audio_cena": {
        "texto_locucao": "Um orquestrador sobe, escala e conserta containers por voce."
      }
    },
    {
      "id": "c-002",
      "nos": [
        "n-003"
      ],
      "transicao_entrada": {
        "tipo": "slide"
      },
      "transicao_saida": {
        "tipo": "none"
      },
      "audio_cena": {
        "texto_locucao": "Ele sobe containers em maquinas saudaveis."
      }
    },
    {
      "id": "c-003",
      "nos": [
        "n-004",
        "n-005",
        "n-006"
      ],
      "audio_cena": {
        "texto_locucao": "Sob trafego, ele sobe mais replicas sozinho."
      }
    }
  ],
  "audio": {
    "trilha_sonora": "energetic"
  }
}
